respondent_id,question,response
0,re_experience,"Sim, foi uma ótima experiência, embora complicada."
1,re_experience,Não 
2,re_experience,"Geralmente,  são os primeiros passos quando começamos um projeto aqui."
3,re_experience,"Trabalho em um projeto a dois anos onde desenvolvemos uma ferramenta que utiliza ML e visão computacional. Durante esses dois anos só foram levantados requisitos dos softwares que envolviam a ferramenta (web, mobile, api) mas não do modelo de ML em si, que era desenvolvido exclusivamente pela equipe de IA. Apenas durante os últimos meses levantei a necessidade de termos requisitos claros estabelecidos para o modelo, para alinhar o comportamento e performance desse as expectativas dos stakeholders. Realizei pessoalmente, com auxílio do time de QA, a definição e documentação de requisitos do modelo. A partir disso, ficou muito claro como e o que era necessário testar no modelo para garantir a qualidade. Isso nos permitiu ir além das métricas tradicionais obtidas com hold-out validation e obter análises mais completas."
4,re_experience,Já participei de todas as fases do ciclo de um projeto em Ciência de Dados.
5,re_experience,Não 
6,re_experience,Não
7,re_experience,"Já participei de projetos de diversas aplicações, metodologias e tecnologias usadas. Projetos de dados na área de engenharia analise e ciencia de dados para principalmente economia, educação, saúde"
8,re_experience,"Registro formal dos requisitos em documentos detalhados, que podem incluir especificações funcionais e não funcionais, casos de uso."
9,re_experience,"Ainda não tive experiência com requisitos em projetos maiores,  apenas em trabalhos acadêmicos."
10,re_experience,"Sim, já participei de alguns processos de elicitação de requisitos, como análise de documentos e entrevistas semiestruturadas."
11,re_experience,Nunca participei.
12,re_experience,"Sim, já participei e principalmente em disciplinas na universidade. Não é a etapa do projeto que mais me instigou, mas achei de extremamente importância porque era o que nos guiava tanto no desenvolvimento como a compartilhar as etapas de desenvolvimento com quem não participava do projeto."
13,re_experience,"Nesse caso, minha experiência nessa parte é mais voltada para a documentação do código e na criação de diagramas referentes a pipelines,  já participei de algumas auditorias feitas pelo time de requisitos mas não me considero uma pessoa com experiência na área. "
14,re_experience,Somente documentação de dependências e bibliotecas.
15,re_experience,"Sim, já participei de processos de refinamento de requisitos, onde discutimos com a equipe a complexidade e capacidade do time para construir as soluções."
16,re_experience,"Sim, participo e acontece no escopo analise e desenho dos processos de negócio implicados na mudança resolvida com o projeto. "
17,re_experience,Não
18,re_experience,Sim
19,re_experience,"Diria que minha experiência em Engenharia de Requisitos é limitada; seria mais preciso dizer que tenho bastante experiência na coleta de requisitos. Já participei de diversas definições, análises e documentações breves, mas os prazos sempre foram extremamente curtos para realizar um estudo aprofundado. Isso ocorre porque, muitas vezes, é necessário propor uma solução rapidamente e submetê-la para aprovação. Além disso, a postura do cliente influencia bastante esse processo. Frequentemente, investimos muito tempo tentando extrair dele os pontos-chave daquilo que ele acredita precisar, para então conseguirmos estruturar minimamente as informações. É claro que isso varia conforme o porte da empresa. Empresas com menor capital tendem a ser mais exploratórias e desorganizadas, enquanto as de capital elevado costumam ser mais restritivas e objetivas. No entanto, sempre há exceções, e algumas grandes empresas fazem exigências tão peculiares que acabam dificultando ainda mais a estruturação do projeto."
20,re_experience,Nunca participei de atividades de engenharia de requisitos
21,re_experience,…
22,re_experience,Documentar sobre os requisitos funcionais como integracoes utilizando API e cadastros de usuarios
23,re_experience,"Esse processo é bem trabalhoso e demorado, pois é preciso ter o entendimento do contexto de negócio e como os dados estão conectados. Além disso, na maioria das vezes, as regras e validações do que deve ser feito está na cabeça do usuário, e existe uma dependência destes especialistas para que a solução seja definida ou entendida."
24,re_experience,Não 
25,re_experience,"Desde sempre participei de atividades de requisitos nos projetos que atuei, em alguns momentos, com menos interações, mas nos últimos cinco anos com grande interação. Nesse sentido, minha atuação visa descrever e avaliar a viabilidade nessa fase de concepção."
26,re_experience,"sim, já atuei na engenharia de requisitos. Sempre foi a etapa crucial para a definição de um bom escopo, evitando atritos entre a equipe e o cliente e preservando prazos e bem estar de trabalho."
27,re_experience,"Participei da elicitação de requisitos para um módulo de um software que iria buscar e processar dados de um data warehouse. Foi feito de maneira informal com os membros relevantes do time em uma reunião, sem a geração de um documento formalizando tudo (apenas uma task aberta no kanban com as descrições do que foi discutido. "
28,re_experience,Participei de algumas jornadas de usuário conversando com clientes para entender como um um produto de IA poderia ajudar no cotidiano do público alvo.
29,re_experience,"Participei na melhoria de requisitos do meu projeto atual. Nesse processo sempre é feita uma reunião com o cliente onde ele faz o levantamento dos cenários e casos que ele deseja obter. Ao final dessas reuniões, fazemos a criação das Histórias, Cenários e Requisitos Funcionais e Não Funcionais. Uma vez concluído esse processo, o cliente então os revisa e, se necessário, os corrige. Esse é um processo interativo, até o momento me que tanto o cliente como nós desenvolvedores chegarmos num consenso."
30,re_experience,"Sim, já participei de todas as fases. Geralmente realizada através da análise de sistemas anteriores e documentações existentes, além de entrevistas e confecção de protótipos."
31,re_experience,Não
32,re_experience,"Eu sempre participo. Inicialmente, as necessidades dos clientes são identificadas. Posteriormente são priorizadas e descritas. As tarefas são divididas em sprints e estimadas nas reuniões de planejamento. Os devs recebem as tarefas de acordo com o capacity e senioridade/especialidade. Utilizamos scrum e kanbam. As tasks são entregues de forma continua em pequenos pacotes de atualizações."
33,re_experience,Normalmente não participo muito na etapa de engenharia de requisitos.
34,re_experience,"Em alguna projetos sim, nesse caso procuro fontes de dados confiaveis que tem relacao ao problema a ser resolvido. As vezes os dados que temos nao tem relacao real com o.problema, ou nao se sabe de fato qual é o problema "
35,re_experience,Não tenho experiência
36,re_experience,"É um processo oneroso, mas se bem feito é extremamente útil no projeto. O que acaba sendo chato são as atualizações necessárias no documento para que ele se mantenha relevante."
37,re_experience,I usually do not focus on Req.
38,re_experience,"Yes, I worked all the stages (Filtering, pré-processing, normalization, training, testing, etc.)"
39,re_experience,"He estado involucrada en definición, análisis, inplemenracion, pruebas y documentación "
40,re_experience,"I have expirience on design and developing GenAI soluctions. I Had this kind of expirience on developing chatbot, Diagnóstico Assistant, class planninh generator and text-tosql"
41,re_experience,"defining, adjusting requirements along with the changes in the understanding of the project, new requirements from stakeholders, impossibility to fulfill some requirements in accordance with technology state"
42,re_experience,"No, zero experience"
43,re_experience,"As a product owner I often participate in workshops, interviews to gather requirements with business analysts and other stakeholders  "
44,re_experience,"Requirements? Oh yeah, definitely. I've been in the trenches with that. Defining, analyzing, documenting – all of it. It's usually a mix of trying to figure out what people really need, and then wrangling that into something usable. Some projects are smooth, some are...less so. But it's always interesting, and crucial to getting things right."
45,re_experience,"I'm from a mecatronic/mechanical background all the projetcs that I was involved were related to engineering, in my experience work with engineering projects don't constitute a problem."
47,re_experience,no
48,re_experience,It is a auto parking project which we aims on parking perception tasks.
49,re_experience,"i wrote lightweight requirements briefling touching on behaviour (including constraints), features"
50,re_experience,Customer Churn Modeling in Card products. Talking to the business stakeholders to understand the definition of the churn for the business
52,re_experience,"As a tech lead, I have been directly involved in defining, analyzing, and documenting requirements. This process usually involves coordinating with stakeholders (POs, CPO, etc) to understand business needs, define expectations, and translate those requirements into technical specifications and tasks."
53,re_experience,"Minha atuação na área de ER sempre esteve restrita a pressupostos metodológicos, atuando mais como um usuário de documentação de requisitos do que alguém atuante na definição dos mesmos (com exceção dos casos pontuais nos quais foi necessária uma intervenção da minha parte para corrigir um equívoco da documentação ou concluir pela inexequibilidade do requisito para um projeto)."
54,re_experience,I've only made very small personal projects so i basically did little to no requirements engineering.
55,re_experience,"I do this very little and in a more incremental way. At work, we usually get ahead of client requests, so we bring prototypes to gather feedback. From there, we keep improving the project and adapting the requirements in practice."
7,imp_justification,"Se os dados forem uma bagunça, o modelo só vai cuspir lixo sofisticado"
11,imp_justification,"Todas as características são importantes ou muito importantes. A separação que fiz foi mais pensando em algo que podemos fazer/corrigir em um segundo momento ou algo que é fundamental de ser pensado desde o início. Considero que algo que se reflete na qualidade dos dados, da informação presente naquele dado são coisas inegociáveis desde o momento inicial. Já questões de documentação, tornar esses dados acessíveis e consistentes entre diferentes base de dados podem ser corrigidas no decorrer do processo, apesar de serem também muito importantes."
12,imp_justification,"Para mim todas as características são de extrema importância, pois a garantia delas influenciam muito positivamente o desenvolvimento de sistemas que utilizam aprendizado de máquina. Dados de má qualidade (e aqui má qualidade vai desde a falta de disponibilidade a dados com pouca precisão e pouco representativos) são um grande problema na área e dificultam o desenvolvimento de novas técnicas."
14,imp_justification,"Os dados precisão refletir com eficiência e sem muitos erros, ao qual ele é proposto ou indica, os dados precisam ser compreensíveis até certo ponto para os humanos, precisam ser confiáveis, em termos de garantir que a informação final não esteja errada se comparada ao esperado no mundo real. "
16,imp_justification,Dependem do escopo do projeto e o do objetivo do aprendizado 
17,imp_justification,"Para a elaboração de sistemas de ML corretos e efetivos, os dados precisam ser consistentes, completos e precisos. Se isso não acontecer, todo o resultado proveniente do seu pipeline de ML pode estar comprometido. A conformidade é importante para a própria construção dos pipelines, já que os seus dados precisam estar padronizados para serem alimentados no seu sistema de ML. Quanto a confiabilidade e a rastreabilidade, a primeira relaciona-se à consistência, o que é essencial em sistemas de ML, enquanto a última é super importante para a execução de testes com dados mais antigos, realização de debugs ou até mesmo processos de rollback."
19,imp_justification,"Consigo imaginar diversos cenários em que todas essas palavras são extremamente importantes de alguma forma. No entanto, acredito que há uma diferença entre algo ser importante e ser necessário para um projeto, especialmente quando se trata de um projeto piloto. Muitas vezes, esses dois aspectos entram em conflito, pois a importância de certos elementos é limitada pela urgência dos prazos, impedindo que coexistam de maneira adequada."
25,imp_justification,"São critérios relevantes, mas que não promovem impedimentos."
26,imp_justification,"Dados mais atuais, precisos e coerentes com o cenário real tendem a apresentar resultados melhores na fase de análise dos modelos em relação as métricas de acerto."
29,imp_justification,"
Dada a negligência à esses pontos levantados, os modelos criados podem não refletir o objetivo pretendido pelo desenvolvedor/pesquisador. Ou em casos piores, podem levar a resultados que podem parecer promissores, mas que em uma análise mais profunda pode estar relacionada à dados que não são devidamente limpos e precisos."
30,imp_justification,"Se o dado não tiver a maioria desses atributos, qualquer resultado de qualquer modelo de ML não será confiável"
31,imp_justification,"Acredito que os dados devem ser confiáveis e fazer sentido, pois é fundamental pra que o sistema funcione corretamente quando for colocado em produção. Para tomar decisões com base nesses dados,  a informação deve ser precisa e consistente."
32,imp_justification,"O mais fundamental é que os dados precisam ser não-ambíguos pois a tomada de decisão precisa ser assertiva. Executar uma ação crítica como por exemplo bloquear o cartão de um cliente 5 estrelas é péssimo. Os dados precisam estar sempre disponíveis, consistentes e atuais. Eu vejo uma grande relação entre consistência e atualidade. Por exemplo, um cliente pode ser tornar inadimplente a qualquer momento. Dados atuais são essenciais principalmente para startups."
33,imp_justification,Precisão é importante pois um dado impreciso causaria erros de aprendizado e predição nos modelos que aprenderiam com esses dados.  Completude é importante pois na vida real o modelo utilizado poderia simplesmente não ser capaz de prever uma observação corretamente pois o dado de treinamento utilizado para este modelo falta exemplos suficientes daquele tipo de dado. 
34,imp_justification,"Acredito que todas as características são importantes,  e precisam serem.levadas para o uso industrial. Em algum nível."
36,imp_justification,Os itens marcados como importantes não sinalizam que os modelos serão menos performáticos. Ainda é possível extrair boas métricas tendo uma base de dados que possui os itens demarcados como muito importantes.
37,imp_justification,Completeness because incomplete data can minimize usefulness of the ML system derived.
38,imp_justification,Because wrong data means wrong results
41,imp_justification,incompleteness of data may significantly bias the model. Highly depend  on the project. 
47,imp_justification,"you expalined acc. but in rating scale you ask for prec.
i ranked them as important as they are needed for the reproducibility of the results, whcih is important to have cumulative knowlede."
48,imp_justification,Industrial engineering consider things differently
12,pri_justification,"São as características que vejo como essenciais para reproduzir técnicas, seja para fins de pesquisa ou mercado. A garantia delas influencia também em um desenvolvimento mais rápido."
15,pri_justification,Confiabilidade para garantir que os dados realmente refletem a área de conhecimento que está como alvo.
19,pri_justification,"Consigo imaginar diversos cenários em que todas essas palavras são extremamente essenciais também. Mas vai depender demais do projeto em questão, então prefiro colocar neutro. "
20,pri_justification,"Todos requisitos são essenciais dependendo do contexto.
A precisão, por exemplo, vai depender do grau do erro dos dados e o quão preciso é necessário que a solução de AM seja. Mas em geral, ter um certo nível de precisão é essencial para qualquer contexto.

A conformidade depende do quão sensíveis forem os dados. Em dados hospitalares ou bancários por exemplo, esse aspécto é super importante.

A eficiência vai depender se o sistema é utilizado em tempo real ou não.

Enfim cada característica dessas é essencial dependendo do contexto. Tentei marcar com mais importância aquelas que são mais comuns em mais contextos.

"
25,pri_justification,"São critérios prioritário, mas não impactam requisitos funcionais."
26,pri_justification,"A consistência e completude indicarão o quanto os dados de fato representam ou não os cenários de um ambiente real, o modelo tenderá a ser melhor acertivo se estes aspectos forem priorizados."
29,pri_justification,"Os pontos marcados como prioritário, se não considerados no inicio do projeto, podem levar a modelos que podem ter problemas de overfitting ou underfitting. Isso com o tempo pode até ser corrigido, porém é algo que pode ser prevenido com dados que já tenham uma credibilidade, precisão e consistência por exemplo."
30,pri_justification,"Mesmo motivo. Todo dado utilizado na execução de algortimos de ML deve ter qualidade, senão todo resultado será duvidoso e não confiável. Não existe meio termo."
31,pri_justification,"Acredito que os dados devem ser confiáveis e fazer sentido, pois é fundamental pra que o sistema funcione corretamente quando for colocado em produção. Para tomar decisões com base nesses dados,  a informação deve ser precisa e consistente."
32,pri_justification,"Quanto mais consistentes os dados, melhor a classificação."
0,balance_open,"Equilibrar precisão, compreensibilidade e eficiência computacional exige escolhas estratégicas. Para modelos críticos, como risco de crédito, priorizamos interpretabilidade (árvores de decisão). Em visão computacional móvel, sacrificamos um pouco de precisão por eficiência (MobileNet). Já em detecção de fraudes, combinamos regras simples (rápidas e explicáveis) com machine learning sofisticado."
1,balance_open,"A prioridade é na precisão dos dados, seguido de compreensibilidade e eficiência "
2,balance_open,Tudo vai depender de como nossa aplicação precisará responder ao usuário 
4,balance_open,"Equilibrar precisão, compreensibilidade e eficiência computacional no desenvolvimento de sistemas de aprendizado de máquina exige decisões estratégicas que dependem do contexto do projeto."
5,balance_open,"Equilibrar precisão, compreensibilidade e eficiência computacional em aprendizado de máquina exige priorização baseada no contexto do projeto. Uso técnicas como seleção de features, redução de dimensionalidade e limpeza de dados para manter a representatividade sem comprometer a interpretabilidade. Modelos mais simples podem ser preferíveis quando a explicabilidade é essencial, enquanto modelos complexos são escolhidos quando a precisão é prioridade. Além disso, monitoro continuamente o desempenho do sistema para ajustar esse equilíbrio conforme necessário."
6,balance_open,.
7,balance_open,"o segredo é encontrar o ponto ideal entre complexidade e praticidade, garantindo um modelo robusto e utilizável"
8,balance_open,"Cada decisão deve ser baseada no contexto específico do projeto e nos objetivos finais, garantindo que a qualidade dos dados seja mantida sem sacrificar outras necessidades críticas."
9,balance_open,Não sei descrever 
10,balance_open,Essas características são essenciais para a entrega de valor e resultados eficientes no âmbito da engenharia e análise de dados.
11,balance_open,"Geralmente o foco se dá inicialmente na qualidade dos dados em termos de serem precisos, completos e atuais. Em um segunda momento pensamos na questão do usuário do sistema e como tornar esse dados mais legíveis. Finalmente, em como otimizar o processamento/pipeline tornando melhor a experiência."
12,balance_open,"Até agora não participei precisamente do desenvolvimento de um sistema que usa aprendizado de máquina, pois só trabalhei com isso no mestrado. Eu trabalho com imagens médicas, a conciliação que precisei fazer foi basicamente entre a falta de consistência (no que se refere a possuir contradição entre diferentes fontes) e atualidade (de um ponto de vista geográfico, por não representar a população brasileira) com compreensibilidade (pois são dados que possuem documentação clara), disponibilidade, acessibilidade e principalmente com credibilidade, pois são dados disponibilizados por uma agência da Organização das Nações Unidas. E tudo isso será documentado, deixando claro como foi o processo de obter esses dados e como entrar em contato para tal."
13,balance_open,"Atualmente sempre venho dando mais ênfase na precisão dos dados, seguido da compreensibilidade e eficiência. Dou prioridade para essa ordem por alguns motivos, o principal deles sendo que (em minhas experiências) quando se utiliza um dataset que não representa dados reais ou realmente representativos do que queremos que os modelos de aprendizado de máquina aprendam o resultado não é satisfatório, a compreensibilidade vem logo em seguida pois facilita tanto o trabalho de ETL (carregar os dados para treinar os modelos) tanto para futura documentação e demonstração dos resultados obtidos pelos modelos, e por fim a eficiência computacional visto que também é preciso manter a capacidade de rodar os modelos com o hardware que for usado. Uma situação que me recordo foi quando estive numa equipe e tivemos que fazer uma escolha entre dois datasets que tinhamos disponíveis para utilizar em um projeto, um deles mais robusto que o outro porém que iria demandar muito mais poder computacional para treinar os modelos em cima dele, no fim acabamos escolhendo ele por representar melhor o tipo de dado que queriamos apresentar no final do projeto. "
14,balance_open,"Em visão computacional, os dados agrupados formam uma informação sobre a imagem, essa informação precisa ser precisa a imagem, compreensível pela máquina e a depender da quantidade, não pode ser muito grande, ou seja, precisa ser direta e com exatidão. "
15,balance_open,"As vezes os dados podem não estarem completos, mas a confiabilidade pode ser mais alta."
16,balance_open,"Varia segundo o objetivo do aprendizado, fontes e metricas dos rótulos "
17,balance_open,"Deve-se sempre entender o problema a ser solucionado para dar importância maior para uma característica em detrimento de outras. A completude, por exemplo, é uma característica muito importante já que os dados precisam estar ""completos"" para serem alimentados em um sistema de ML. A consistência e a credibilidade, por exemplo, podem ser características a serem balanceadas. Por vezes, encontramos inconsistências em nossas fontes de dados e precisamos optar pela fonte de maior credibilidade"
18,balance_open,O problema é quando os dados nao sao consitentes o incopletos a inferência e resultado final o cliente pode ser confuso e incompleto. Precisa de refazer o processo varias vezes isso leva a gastos de infra em todo o fluxo
19,balance_open,"O que costumo ver com muita frequência é ver primeiro o resultado e depois avaliar como ele poderia ser melhorado, revisitando essas características. Aqui depende muito do tipo do projeto também."
20,balance_open,"Realmente depende do contexto. Atualmente participo de um projeto que trata anamneses de hospitais. Para manter a conformidade, abordamos soluções de aprendizado de máquina federado, onde os dados permanecem locais."
21,balance_open,"No geral boas ferramentas de mercado como o databricks ajuda o cientista de dados a focar na solução, pois isso é tratado de forma estratégica e inteligente pelo sistema. Resumindo, escolha bem sua plataforma e defina bem os requisitos do sistema."
22,balance_open,"Nao desenvolvi nenhum sistema com AM mas quando desenvolvo tudo faco por fazer para cada pilar como: disponibilidade, seguranca, confiabilidade e boas praticas"
23,balance_open,São características que definem a qualidade do dado para ser utilizado em soluções de IA
24,balance_open,"Eu tento, tudo depende do problema a ser solucionado o conjunto de dados que eu tenha disponível. Após conhecer a amostra começo a tomar decisões sobre como.pafronizacao, o que deve ser removido ou incrementado, tentando remover os possíveis ruídos para melhorar o.resultados finais "
25,balance_open,"Ser preciso é uma necessidade de negócio em sistemas de Aprendizado de Máquina e isso deve requerer confiabilidade, o que pode impactar na eficiência computacional. Sob esta fala, sistemas de análises médicas permeiam o cenário descrito, afinal imagens clínicas geralmente têm alta resolução pois demandam confiabilidade para apresentação dos laudos. Ou seja, essas imagens representam grandes volumes de dados, impactando na eficiência computacional desse sistema."
26,balance_open,"Dependerá da aplicação, se há requisitos de tempo real ou não, se o tempo de espera para a resposta do modelo é algo sensível ou não, pois isso pode levar a uma maior flexibilidade quanto as taxas de acerto e pririzando a eficiência."
